{
  "schema_version": 2,
  "slug": "localization/language-key-display-name-normalization",
  "title": "Language Key and Display Name Normalization",
  "maturity": "runtime_ready",
  "workflow": "accepted",
  "owned_paths": [
    "docs/history/card-plans/closed/语言键与显示名规范收口详细计划.md",
    "src/main/java/com/masson/cruciblecraft/localization/LanguageNames.java",
    "src/main/java/com/masson/cruciblecraft/datagen/ModLanguageProvider.java",
    "src/main/java/com/masson/cruciblecraft/material/gen/GeneratedMaterialPack.java",
    "src/main/java/com/masson/cruciblecraft/material/MaterialZhNames.java",
    "src/main/java/com/masson/cruciblecraft/content/item/MaterialFormItem.java",
    "src/main/java/com/masson/cruciblecraft/content/item/GtStoneCatalog.java",
    "src/main/resources/data/cruciblecraft/language_display_contract.json",
    "src/main/resources/data/cruciblecraft/material_zh_cn.json",
    "src/generated/resources/assets/cruciblecraft/lang/**",
    "src/test/java/com/masson/cruciblecraft/datagen/**",
    "tools/language_names.py",
    "tools/generated_resource_gate.py",
    "tools/player_complete.py",
    "tools/catalog_modern_ids.py",
    "tools/tests/test_generated_resource_gate.py",
    "tools/tests/test_player_complete.py",
    "tools/capabilities/localization/language-key-display-name-normalization/**",
    "tools/waves/prep/localization-language-key-display-name-normalization/**"
  ],
  "depends_on": [],
  "profiles": [
    "capability-runtime"
  ],
  "wave_slug": "localization/language-key-display-name-normalization",
  "identity_disposition": [],
  "note": "Canonical dotted translation keys, English formatter, zh omit-fallback, and display-name collision gate. Close at runtime_ready, not player_complete. Registry ids, models, loot, and save ids stay unchanged."
}
